<?xml version="1.0" encoding="UTF-8"?>
<!ELEMENT acl (class, deny-url, config, uid, pw)>
<!ATTLIST acl
	name CDATA #REQUIRED
>
<!ELEMENT class (#PCDATA)>
<!ELEMENT config (#PCDATA)>
<!ELEMENT default (deny-url)>
<!ELEMENT dcs-profile (default, acl+)>
<!ELEMENT deny-url (#PCDATA)>
<!ELEMENT uid (#PCDATA)>
<!ELEMENT pw (#PCDATA)>
