<?xml version="1.0" encoding="UTF-8"?>
<!DOCTYPE dcs-profile SYSTEM "ProfileConfiguration.dtd">
<dcs-profile>
	<default>
	    <deny-url>https://dummy.eaton.com</deny-url>
	</default>
	<acl name="PORTAL">
		<!-- Toggle the entries below to switch between portal servers (new is IdentityServerACLProfile) -->
		<class>com.eaton.securedocs.IdentityServerACLProfile</class>
		<!--<class>com.eaton.securedocs.JOEACLProfile</class>-->
		<deny-url>https://dummy.eaton.com</deny-url>
		<config>/conf/smrcACL.properties</config>
		<uid></uid>
		<pw></pw>
	</acl>
</dcs-profile>
